{
  "$schema": "http://json-schema.org/draft-07/schema#",
  "$id": "https://clawrocket.dev/contracts/editorial-room/v0/setup_state.schema.json",
  "title": "SetupState",
  "description": "EditorialPiece.setup_state — load-bearing context for downstream phases. See docs/EDITORIAL_ROOM_CONTRACT.md §2. Owned by clawrocket.",
  "type": "object",
  "additionalProperties": false,
  "required": [
    "schema_version",
    "setup_version",
    "deliverable_type",
    "voice_page_slug",
    "length_target",
    "destination",
    "audience_persona_slugs",
    "llm_room_agent_profile_ids",
    "scoring_pipeline_slug",
    "updated_at",
    "updated_by_user_id"
  ],
  "properties": {
    "schema_version": {
      "const": "0",
      "description": "Contract version. Always '0' until first production deployment per §8."
    },
    "setup_version": {
      "type": "integer",
      "minimum": 1,
      "description": "Monotonic; increments on any field change. Used as staling key for downstream score_snapshots, discussion_sessions, etc. (per §1, §2.2)."
    },
    "deliverable_type": {
      "type": "string",
      "enum": ["longform_post", "podcast_script", "book_chapter", "social_post", "memo"]
    },
    "voice_page_slug": {
      "type": "string",
      "minLength": 1,
      "description": "Ref to rocketorchestra voice page (e.g., 'voice/gamemakers-2026')."
    },
    "length_target": {
      "anyOf": [
        { "type": "null" },
        {
          "type": "object",
          "additionalProperties": false,
          "required": ["min_words", "max_words"],
          "properties": {
            "min_words": { "type": "integer", "minimum": 1 },
            "max_words": { "type": "integer", "minimum": 1 }
          }
        }
      ],
      "description": "null = no target. Runtime invariant (not encoded here): min_words <= max_words."
    },
    "destination": {
      "type": "string",
      "enum": ["substack_md", "google_doc", "plain_md", "youtube_script", "other"]
    },
    "audience_persona_slugs": {
      "type": "array",
      "items": { "type": "string", "minLength": 1 },
      "minItems": 1,
      "maxItems": 3,
      "description": "Ordered. Min 1, max 3 initially per §2.1. Each element is a rocketorchestra persona page slug."
    },
    "llm_room_agent_profile_ids": {
      "type": "array",
      "items": { "type": "string", "minLength": 1 },
      "minItems": 2,
      "maxItems": 6,
      "description": "Ordered. Min 2, max 6 initially per §2.1. Each element is a clawrocket agent profile id."
    },
    "scoring_pipeline_slug": {
      "type": "string",
      "minLength": 1,
      "description": "Ref to rocketorchestra scoring_pipeline page."
    },
    "updated_at": {
      "type": "string",
      "format": "date-time",
      "description": "ISO 8601 timestamp."
    },
    "updated_by_user_id": {
      "type": "string",
      "minLength": 1,
      "description": "auth.users.id (Supabase Auth in production; local fixture identity in 0p)."
    }
  }
}
