{
  "schema_version": "0",
  "setup_version": 1,
  "deliverable_type": "longform_post",
  "voice_page_slug": "voice/gamemakers-2026",
  "length_target": null,
  "destination": "plain_md",
  "audience_persona_slugs": ["persona/ankit-indie-dev"],
  "llm_room_agent_profile_ids": ["agent/argus", "agent/scribe"],
  "scoring_pipeline_slug": "scoring_pipeline/gamemakers_default",
  "updated_at": "2026-04-30T00:00:00.000Z",
  "updated_by_user_id": "user_local_joseph"
}
