{
  "schema_version": "0",
  "setup_version": 7,
  "deliverable_type": "longform_post",
  "voice_page_slug": "voice/gamemakers-2026",
  "length_target": {
    "min_words": 2000,
    "max_words": 2500
  },
  "destination": "substack_md",
  "audience_persona_slugs": [
    "persona/ankit-indie-dev",
    "persona/ravi-studio-lead",
    "persona/mei-publisher"
  ],
  "llm_room_agent_profile_ids": [
    "agent/argus",
    "agent/scribe",
    "agent/mei-cohort"
  ],
  "scoring_pipeline_slug": "scoring_pipeline/gamemakers_default",
  "updated_at": "2026-04-30T11:42:18.123Z",
  "updated_by_user_id": "user_local_joseph"
}
